{
  "$id": "https://raw.githubusercontent.com/outfitter-dev/skillset/main/docs/reference/schemas/0.1.0/source-metadata.schema.json",
  "$schema": "https://json-schema.org/draft/2020-12/schema",
  "additionalProperties": false,
  "properties": {
    "author": {
      "anyOf": [
        {
          "minLength": 1,
          "type": "string"
        },
        {
          "additionalProperties": true,
          "properties": {
            "email": {
              "minLength": 1,
              "type": "string"
            },
            "name": {
              "minLength": 1,
              "type": "string"
            },
            "url": {
              "minLength": 1,
              "type": "string"
            }
          },
          "required": [
            "name"
          ],
          "type": "object"
        }
      ]
    },
    "category": {
      "type": "string"
    },
    "description": {
      "minLength": 1,
      "type": "string"
    },
    "homepage": {
      "type": "string"
    },
    "keywords": {
      "items": {
        "type": "string"
      },
      "type": "array"
    },
    "license": {
      "enum": [
        "Apache-2.0",
        "BSD-2-Clause",
        "BSD-3-Clause",
        "ISC",
        "MIT",
        "MPL-2.0",
        "none"
      ],
      "type": "string"
    },
    "listing": {
      "additionalProperties": false,
      "properties": {
        "capabilities": {
          "items": {
            "minLength": 1,
            "type": "string"
          },
          "type": "array"
        },
        "category": {
          "minLength": 1,
          "type": "string"
        },
        "color": {
          "minLength": 1,
          "type": "string"
        },
        "composer_icon": {
          "minLength": 1,
          "type": "string"
        },
        "default_prompt": {
          "items": {
            "minLength": 1,
            "type": "string"
          },
          "type": "array"
        },
        "description": {
          "minLength": 1,
          "type": "string"
        },
        "display_name": {
          "minLength": 1,
          "type": "string"
        },
        "keywords": {
          "items": {
            "minLength": 1,
            "type": "string"
          },
          "type": "array"
        },
        "logo": {
          "minLength": 1,
          "type": "string"
        },
        "logo_dark": {
          "minLength": 1,
          "type": "string"
        },
        "privacy_policy_url": {
          "minLength": 1,
          "type": "string"
        },
        "screenshots": {
          "items": {
            "minLength": 1,
            "type": "string"
          },
          "type": "array"
        },
        "summary": {
          "minLength": 1,
          "type": "string"
        },
        "terms_of_service_url": {
          "minLength": 1,
          "type": "string"
        },
        "website_url": {
          "minLength": 1,
          "type": "string"
        }
      },
      "type": "object"
    },
    "manifest": {
      "additionalProperties": true,
      "properties": {
        "category": {
          "minLength": 1,
          "type": "string"
        },
        "displayName": {
          "minLength": 1,
          "type": "string"
        },
        "logo": {
          "minLength": 1,
          "type": "string"
        },
        "name": {
          "minLength": 1,
          "type": "string"
        },
        "tags": {
          "items": {
            "minLength": 1,
            "type": "string"
          },
          "type": "array"
        }
      },
      "type": "object"
    },
    "marketplace": {
      "type": "object"
    },
    "name": {
      "minLength": 1,
      "type": "string"
    },
    "origin": {
      "additionalProperties": false,
      "dependentRequired": {
        "ref": [
          "repo"
        ],
        "repo": [
          "ref"
        ]
      },
      "properties": {
        "path": {
          "minLength": 1,
          "type": "string"
        },
        "ref": {
          "minLength": 1,
          "type": "string"
        },
        "repo": {
          "minLength": 1,
          "type": "string"
        }
      },
      "required": [
        "path"
      ],
      "type": "object"
    },
    "outputs": {
      "additionalProperties": true,
      "properties": {
        "skills": {
          "additionalProperties": true,
          "allOf": [
            {
              "not": {
                "required": [
                  "claude"
                ]
              }
            },
            {
              "not": {
                "required": [
                  "codex"
                ]
              }
            },
            {
              "not": {
                "required": [
                  "cursor"
                ]
              }
            }
          ],
          "type": "object"
        }
      },
      "type": "object"
    },
    "owner": {
      "additionalProperties": true,
      "properties": {
        "email": {
          "minLength": 1,
          "type": "string"
        },
        "name": {
          "minLength": 1,
          "type": "string"
        },
        "url": {
          "minLength": 1,
          "type": "string"
        }
      },
      "required": [
        "name"
      ],
      "type": "object"
    },
    "preprocess": {
      "type": "boolean"
    },
    "presentation": {
      "type": "object"
    },
    "repository": {
      "type": "string"
    },
    "schema": {
      "const": 1,
      "type": "integer"
    },
    "strict": {
      "type": "boolean"
    },
    "summary": {
      "minLength": 1,
      "type": "string"
    },
    "title": {
      "minLength": 1,
      "type": "string"
    },
    "unresolved_frontmatter": {
      "items": {
        "minLength": 1,
        "type": "string"
      },
      "minItems": 1,
      "type": "array",
      "uniqueItems": true
    },
    "version": {
      "pattern": "^(0|[1-9]\\d*)\\.(0|[1-9]\\d*)\\.(0|[1-9]\\d*)(?:-((?:0|[1-9]\\d*|[A-Za-z-][0-9A-Za-z-]*)(?:\\.(?:0|[1-9]\\d*|[A-Za-z-][0-9A-Za-z-]*))*))?(?:\\+([0-9A-Za-z-]+(?:\\.[0-9A-Za-z-]+)*))?$",
      "type": "string"
    }
  },
  "title": "Source Metadata",
  "type": "object"
}
