{
  "$schema": "https://agent-plugins.org/schemas/1.0.0/plugin.schema.json",
  "author": {
    "name": "Skillset Maintainers"
  },
  "description": "Build source skills and plugins into Claude, Codex, and Cursor outputs.",
  "keywords": [
    "skillset",
    "skills",
    "plugins",
    "claude",
    "codex"
  ],
  "license": "MIT",
  "name": "skillset",
  "version": "0.1.1"
}
